{
  "schemaVersion": "1.0",
  "id": "00000000-0000-4000-8000-000000000000",
  "type": "check.result",
  "at": "2026-01-01T00:00:00.000Z",
  "project": "example-project",
  "task": "T-001",
  "model": "unknown",
  "kitVersion": "0.0.0",
  "commit": null,
  "sessionId": null,
  "machine": null,
  "data": { "verdict": "fail", "findings": ["<ข้อที่ /check เจอ>"], "level": null }
}
